{"acceptance_report_sha256":"faf30d3b844c5b176bc74b3f85d6c0d19b9ba99170e3ca34b92c0fb69045ebf3","accepted_at_utc":"2026-09-24T22:45:42.929518Z","freeze_manifest_sha256":"39f2dc292cde1265fb27d52989b739fe085ca15941eb521210bb133b8cc0ce99","gate_evidence":{"acceptance_id":"KDEN_V375_UNIVERSAL_ISSUE_STATE_ACCEPTANCE_V1","anchor_rebuild_count":7,"anchor_rebuilds_exact":true,"canonical_source_files_hashed":66558,"clock_equations_verified":true,"dst_verified":true,"dynamic_trajectory_row_count":8919597,"explicit_missing_trajectory_row_count":12,"explicit_missingness_verified":true,"feature_count":433,"feature_range_errata_count":3,"feature_range_errata_id":"KDEN_V375_P06_FEATURE_RANGE_ERRATA_V1","feature_range_errata_names":["derived_dewpoint_depression_future_first_k","support_wrfsfcf_retained_start_offset_minutes","support_wrfsubhf_retained_start_offset_minutes"],"feature_row_count":118536,"issue_row_count":118536,"issue_time_availability_verified":true,"lead_horizon_interval_units_verified":true,"madis_rows_read":0,"market_rows_read":0,"model_fits_performed":0,"model_neutral_leakage_scan":{"feature_columns_scanned":442,"fold_or_prediction_leakage_found":0,"forbidden_predictor_tokens":["truth","y_audited","target_value","market","kalshi","settlement","madis","outcome","label","fold","prediction"],"madis_leakage_found":0,"market_leakage_found":0,"outcome_leakage_found":0,"trajectory_columns_scanned":36,"truth_leakage_found":0},"network_requests_made":0,"release_id":"KDEN_V375_UNIVERSAL_ISSUE_STATE_V1","right_open_windows_verified":true,"runtime_isolation":{"absolute_user_paths_found":0,"denied_import_prefixes":["kden35","kden_panel"],"legacy_runtime_references_found":0,"package_root":"src/kden_v375"},"selection_row_count":237072,"spatial_and_coordinate_era_rules_verified":true,"static_trajectory_row_count":1,"target_day_count":2080,"target_year_partition_count":6,"total_trajectory_row_count":8919598,"truth_value_rows_read":0},"p05_record_sha256":"7e1366d32972aa492ae1064c354bfb0261401f59a16e16a26e12a65df96c4132","record_sha256":"45d226fe8e23fc4291bda55cac6736806f5a77b3308970eaa77d4b7a909f6dd5","release_id":"KDEN_V375_UNIVERSAL_ISSUE_STATE_V1","schema_version":"KDEN_V375_UNIVERSAL_ISSUE_STATE_PASS_V1","status":"PASS"}
